{
  "gate": "gate-2-to-3",
  "plugin": "O-Wind",
  "fromStage": "2-dsp",
  "toStage": "3-gui",
  "timestamp": "2026-04-05T20:46:45Z",
  "checks": {
    "critical": [{"name":"schema","status":"passed","duration":1000,"attempts":1,"output":"Validating: /Users/taylorbrook/Dev/VST-development/plugins/O-Wind/.planning/stages/2-dsp/HANDOFF.json\n----------------------------------------\nSchema: handoff-2-to-3.schema.json\nRunning schema validation...\nunknown format \"date-time\" ignored in schema at path \"#/properties/timestamp\"\nunknown format \"date-time\" ignored in schema at path \"#/properties/timestamp\"\nunknown format \"date-time\" ignored in schema at path \"#/properties/validation/properties/checkedAt\"\nunknown format \"date-time\" ignored in schema at path \"#/properties/validation/properties/checkedAt\"\nunknown format \"date\" ignored in schema at path \"decision-entry.schema.json/properties/date\"\nunknown format \"date\" ignored in schema at path \"decision-entry.schema.json/properties/date\"\n/Users/taylorbrook/Dev/VST-development/plugins/O-Wind/.planning/stages/2-dsp/HANDOFF.json valid\n\u001b[0;32mSchema validation: PASSED\u001b[0m\n\nChecking artifact existence...\n\u001b[0;32mArtifacts: 16 required, all present\u001b[0m\n\n========================================\n\u001b[0;32mVALIDATION PASSED\u001b[0m\n","error":"\n"},{"name":"build","status":"passed","duration":0,"attempts":1,"output":"[0/2] Re-checking globbed directories...\nninja: no work to do.\n","error":"\n"},{"name":"pluginval","status":"skipped","duration":0,"attempts":1,"output":"\n","error":"VST3 plugin not found at /Users/taylorbrook/Dev/VST-development/build/plugins/O-Wind/O-Wind_artefacts/Release/VST3/O-Wind.vst3\n"},{"name":"dsp-critic","status":"passed","duration":0,"attempts":1,"output":"\n\u001b[1m========================================\u001b[0m\n\u001b[1m         CRITIC VALIDATION\u001b[0m\n\u001b[1m========================================\u001b[0m\n\nCritic:       \u001b[0;36mdsp-critic\u001b[0m\nPlugin:       O-Wind\nStage:        2-dsp\nMode:         Smoke\n\n\u001b[1m┌────────────────────────────────────┐\u001b[0m\n\u001b[1m│      Attempt 1 / 3                   │\u001b[0m\n\u001b[1m└────────────────────────────────────┘\u001b[0m\n\n----------------------------------------\n\n\u001b[0;36mCritic Evaluation Phase\u001b[0m\n\nThe critic agent will now evaluate the plugin against:\n  - Real-time safety (threshold: 8/10)\n  - Buffer handling (threshold: 7/10)\n  - Parameter integration (threshold: 6/10)\n  - [Optional] Numerical stability\n  - [Optional] Architecture alignment\n\nExpected Output:\n  Report location: /Users/taylorbrook/Dev/VST-development/.planning/verification/O-Wind/2-dsp/\n  Schema: critic-dsp-report.schema.json\n\n\u001b[0;36mEarly-Stop Conditions:\u001b[0m\n  1. All scores >= thresholds -> PASSED (exit 0)\n  2. Same issues as previous iteration -> NO_PROGRESS (exit 2)\n  3. Attempt >= 3 -> MAX_ITERATIONS (exit 2)\n\n----------------------------------------\n\n\u001b[0;36mIntegration Points:\u001b[0m\n  - Compatible with stage-transition-gate.sh\n  - Failure reports persist for debugging\n  - Token metrics tracked for cost awareness\n\n\u001b[0;32mCRITIC FRAMEWORK READY\u001b[0m\n\nTo perform actual validation:\n  1. Claude agent invokes critic template for 2-dsp\n  2. Agent produces report matching critic-dsp-report.schema.json\n  3. This script validates and determines next action\n\nExit Codes for Integration:\n  0 = PASSED (proceed to gate)\n  1 = NEEDS_FIXES (iterate with fixes)\n  2 = ESCALATE (user intervention needed)\n","error":"\n"}],
    "advisory": [{"name":"style","status":"skipped","duration":0,"attempts":1,"output":"\n","error":"Placeholder - future work\n"},{"name":"naming","status":"skipped","duration":0,"attempts":1,"output":"\n","error":"Placeholder - future work\n"},{"name":"docs","status":"skipped","duration":0,"attempts":1,"output":"\n","error":"Placeholder - future work\n"}]
  },
  "overallStatus": "PASSED",
  "totalDuration": 1000
,
  "review": {
    "status": "skipped",
    "notes": "\n",
    "skipped": true
,    "skipJustification": "No justification provided\n"
  }
}
