{
  "gate": "gate-1-to-2",
  "plugin": "O-Tapestop",
  "fromStage": "1-foundation",
  "toStage": "2-dsp",
  "timestamp": "2026-08-15T21:57:55Z",
  "checks": {
    "critical": [{"name":"schema","status":"skipped","duration":0,"attempts":1,"output":"\n","error":"No handoff file found\n"},{"name":"build","status":"passed","duration":0,"attempts":1,"output":"[0/2] Re-checking globbed directories...\n[1/2] Building VST3 manifest helper for OuariconTapestop\n-- Configuring done (0.0s)\n-- Generating done (0.0s)\n-- Build files have been written to: /Users/taylorbrook/Dev/VST-development/build/vst3_helpers/OuariconTapestop\nninja: no work to do.\n","error":"\n"},{"name":"pluginval","status":"passed","duration":15000,"attempts":1,"output":"Started validating: /Users/taylorbrook/Dev/VST-development/build/plugins/O-Tapestop/OuariconTapestop_artefacts/Release/VST3/O-Tapestop-dev.vst3\nRandom seed: 0x2f7be09\nValidation started\nStrictness level: 10\n-----------------------------------------------------------------\nStarting tests in: pluginval / Scan for plugins located in: /Users/taylorbrook/Dev/VST-development/build/plugins/O-Tapestop/OuariconTapestop_artefacts/Release/VST3/O-Tapestop-dev.vst3...\nNum plugins found: 1\n\nTesting plugin: VST3-O-Tapestop-dev-8a234d5e-3cefcf44\nOuaricon Audio Development: O-Tapestop-dev v0.1.0\nCompleted tests in pluginval / Scan for plugins located in: /Users/taylorbrook/Dev/VST-development/build/plugins/O-Tapestop/OuariconTapestop_artefacts/Release/VST3/O-Tapestop-dev.vst3\n-----------------------------------------------------------------\nStarting tests in: pluginval / Open plugin (cold)...\nCompleted tests in pluginval / Open plugin (cold)\n-----------------------------------------------------------------\nStarting tests in: pluginval / Open plugin (warm)...\nRunning tests 1 times\nCompleted tests in pluginval / Open plugin (warm)\n-----------------------------------------------------------------\nStarting tests in: pluginval / Plugin info...\n\nPlugin name: O-Tapestop-dev\nAlternative names: O-Tapestop-dev\nSupportsDoublePrecision: no\nReported latency: 0\nReported taillength: 0\nCompleted tests in pluginval / Plugin info\n-----------------------------------------------------------------\nStarting tests in: pluginval / Plugin programs...\nNum programs: 0\nAll program names checked\nCompleted tests in pluginval / Plugin programs\n-----------------------------------------------------------------\nStarting tests in: pluginval / Editor...\nCompleted tests in pluginval / Editor\n-----------------------------------------------------------------\nStarting tests in: pluginval / Open editor whilst processing...\nCompleted tests in pluginval / Open editor whilst processing\n-----------------------------------------------------------------\nStarting tests in: pluginval / Audio processing...\nTesting with sample rate [44100] and block size [64]\nTesting with sample rate [44100] and block size [128]\nTesting with sample rate [44100] and block size [256]\nTesting with sample rate [44100] and block size [512]\nTesting with sample rate [44100] and block size [1024]\nTesting with sample rate [48000] and block size [64]\nTesting with sample rate [48000] and block size [128]\nTesting with sample rate [48000] and block size [256]\nTesting with sample rate [48000] and block size [512]\nTesting with sample rate [48000] and block size [1024]\nTesting with sample rate [96000] and block size [64]\nTesting with sample rate [96000] and block size [128]\nTesting with sample rate [96000] and block size [256]\nTesting with sample rate [96000] and block size [512]\nTesting with sample rate [96000] and block size [1024]\nCompleted tests in pluginval / Audio processing\n-----------------------------------------------------------------\nStarting tests in: pluginval / Non-releasing audio processing...\nTesting with sample rate [44100] and block size [64]\nTesting with sample rate [44100] and block size [128]\nTesting with sample rate [44100] and block size [256]\nTesting with sample rate [44100] and block size [512]\nTesting with sample rate [44100] and block size [1024]\nTesting with sample rate [48000] and block size [64]\nTesting with sample rate [48000] and block size [128]\nTesting with sample rate [48000] and block size [256]\nTesting with sample rate [48000] and block size [512]\nTesting with sample rate [48000] and block size [1024]\nTesting with sample rate [96000] and block size [64]\nTesting with sample rate [96000] and block size [128]\nTesting with sample rate [96000] and block size [256]\nTesting with sample rate [96000] and block size [512]\nTesting with sample rate [96000] and block size [1024]\nCompleted tests in pluginval / Non-releasing audio processing\n-----------------------------------------------------------------\nStarting tests in: pluginval / Plugin state...\nCompleted tests in pluginval / Plugin state\n-----------------------------------------------------------------\nStarting tests in: pluginval / Plugin state restoration...\nCompleted tests in pluginval / Plugin state restoration\n-----------------------------------------------------------------\nStarting tests in: pluginval / Automation...\nTesting with sample rate [44100] and block size [64] and sub-block size [32]\nTesting with sample rate [44100] and block size [128] and sub-block size [32]\nTesting with sample rate [44100] and block size [256] and sub-block size [32]\nTesting with sample rate [44100] and block size [512] and sub-block size [32]\nTesting with sample rate [44100] and block size [1024] and sub-block size [32]\nTesting with sample rate [48000] and block size [64] and sub-block size [32]\nTesting with sample rate [48000] and block size [128] and sub-block size [32]\nTesting with sample rate [48000] and block size [256] and sub-block size [32]\nTesting with sample rate [48000] and block size [512] and sub-block size [32]\nTesting with sample rate [48000] and block size [1024] and sub-block size [32]\nTesting with sample rate [96000] and block size [64] and sub-block size [32]\nTesting with sample rate [96000] and block size [128] and sub-block size [32]\nTesting with sample rate [96000] and block size [256] and sub-block size [32]\nTesting with sample rate [96000] and block size [512] and sub-block size [32]\nTesting with sample rate [96000] and block size [1024] and sub-block size [32]\nCompleted tests in pluginval / Automation\n-----------------------------------------------------------------\nStarting tests in: pluginval / Editor Automation...\nCompleted tests in pluginval / Editor Automation\n-----------------------------------------------------------------\nStarting tests in: pluginval / Automatable Parameters...\nCompleted tests in pluginval / Automatable Parameters\n-----------------------------------------------------------------\nStarting tests in: pluginval / Parameters...\nCompleted tests in pluginval / Parameters\n-----------------------------------------------------------------\nStarting tests in: pluginval / Background thread state...\nCompleted tests in pluginval / Background thread state\n-----------------------------------------------------------------\nStarting tests in: pluginval / Parameter thread safety...\nCompleted tests in pluginval / Parameter thread safety\n-----------------------------------------------------------------\nStarting tests in: pluginval / auval...\nCompleted tests in pluginval / auval\n-----------------------------------------------------------------\nStarting tests in: pluginval / vst3 validator...\nINFO: Skipping vst3 validator as validator path hasn't been set\nCompleted tests in pluginval / vst3 validator\n-----------------------------------------------------------------\nStarting tests in: pluginval / Basic bus...\nCompleted tests in pluginval / Basic bus\n-----------------------------------------------------------------\nStarting tests in: pluginval / Listing available buses...\nInputs:\n\tNamed layouts: Mono, Stereo\n\tDiscrete layouts: Discrete #1\nOutputs:\n\tNamed layouts: Mono, Stereo\n\tDiscrete layouts: Discrete #1\nMain bus num input channels: 2\nMain bus num output channels: 2\nCompleted tests in pluginval / Listing available buses\n-----------------------------------------------------------------\nStarting tests in: pluginval / Enabling all buses...\nCompleted tests in pluginval / Enabling all buses\n-----------------------------------------------------------------\nStarting tests in: pluginval / Disabling non-main busses...\nCompleted tests in pluginval / Disabling non-main busses\n-----------------------------------------------------------------\nStarting tests in: pluginval / Restoring default layout...\nMain bus num input channels: 2\nMain bus num output channels: 2\nCompleted tests in pluginval / Restoring default layout\n-----------------------------------------------------------------\nStarting tests in: pluginval / Fuzz parameters...\nCompleted tests in pluginval / Fuzz parameters\nSUCCESS\n","error":"\n"}],
    "advisory": [{"name":"style","status":"skipped","duration":0,"attempts":1,"output":"\n","error":"Placeholder - future work\n"},{"name":"naming","status":"skipped","duration":0,"attempts":1,"output":"\n","error":"Placeholder - future work\n"},{"name":"docs","status":"skipped","duration":0,"attempts":1,"output":"\n","error":"Placeholder - future work\n"}]
  },
  "overallStatus": "PASSED",
  "totalDuration": 15000
,
  "review": {
    "status": "approved",
    "notes": "Reviewed: Stage-1 shell clean — ScopedNoDenormals, no processBlock allocations, bounded channel clear, bit-transparent pass-through per Stage-0 decision 6, no dead code\n",
    "skipped": false
  }
}
