{
  "gate": "gate-0-to-1",
  "plugin": "O-Wind",
  "fromStage": "0-ideation",
  "toStage": "1-foundation",
  "timestamp": "2026-04-05T06:06:08Z",
  "checks": {
    "critical": [{"name":"schema","status":"skipped","duration":0,"attempts":1,"output":"\n","error":"No handoff file found\n"},{"name":"build","status":"failed","duration":0,"attempts":3,"output":"[0/2] Re-checking globbed directories...\n","error":"ninja: error: unknown target 'O-Wind_VST3', did you mean 'O-Gain_VST3'?\n"},{"name":"pluginval","status":"skipped","duration":0,"attempts":1,"output":"\n","error":"VST3 plugin not found at /Users/taylorbrook/Dev/VST-development/build/plugins/O-Wind/O-Wind_artefacts/Release/VST3/O-Wind.vst3\n"}],
    "advisory": [{"name":"style","status":"skipped","duration":0,"attempts":1,"output":"\n","error":"Placeholder - future work\n"},{"name":"naming","status":"skipped","duration":0,"attempts":1,"output":"\n","error":"Placeholder - future work\n"},{"name":"docs","status":"skipped","duration":0,"attempts":1,"output":"\n","error":"Placeholder - future work\n"}]
  },
  "overallStatus": "BLOCKED",
  "totalDuration": 3000
}
