{
  "gate": "gate-0-to-1",
  "plugin": "O-Contrabass",
  "fromStage": "0-ideation",
  "toStage": "1-foundation",
  "timestamp": "2026-04-26T16:43:38Z",
  "checks": {
    "critical": [{"name":"schema","status":"skipped","duration":0,"attempts":1,"output":"\n","error":"No handoff file found\n"},{"name":"build","status":"failed","duration":0,"attempts":3,"output":"[0/2] Re-checking globbed directories...\n","error":"ninja: error: unknown target 'O-Contrabass_VST3'\n"},{"name":"pluginval","status":"skipped","duration":0,"attempts":1,"output":"\n","error":"VST3 plugin not found at /Users/taylorbrook/Dev/VST-development/build/plugins/O-Contrabass/O-Contrabass_artefacts/Release/VST3/O-Contrabass.vst3\n"}],
    "advisory": [{"name":"style","status":"skipped","duration":0,"attempts":1,"output":"\n","error":"Placeholder - future work\n"},{"name":"naming","status":"skipped","duration":0,"attempts":1,"output":"\n","error":"Placeholder - future work\n"},{"name":"docs","status":"skipped","duration":0,"attempts":1,"output":"\n","error":"Placeholder - future work\n"}]
  },
  "overallStatus": "BYPASSED",
  "totalDuration": 2000
,
  "bypass": {
    "used": true,
    "justification": "Stage 1 creates CMake target; build cannot pass until foundation completes (0->1 chicken-and-egg, no source code exists yet)\n",
    "failedChecks": ["build"]
  }
}
