{
  "gate": "gate-0-to-1",
  "plugin": "O-simpleAmbisonics",
  "fromStage": "0-ideation",
  "toStage": "1-foundation",
  "timestamp": "2026-10-12T15:24:00Z",
  "checks": {
    "critical": [{"name":"schema","status":"skipped","duration":0,"attempts":1,"output":"\n","error":"No handoff file found\n"},{"name":"build","status":"failed","duration":0,"attempts":3,"output":"[0/2] Re-checking globbed directories...\n","error":"ninja: error: unknown target 'O-simpleAmbisonics_VST3'\n"},{"name":"pluginval","status":"skipped","duration":0,"attempts":1,"output":"\n","error":"VST3 plugin not found at /Users/taylorbrook/Dev/VST-development/build/plugins/O-simpleAmbisonics/O-simpleAmbisonics_artefacts/Release/VST3/O-simpleAmbisonics.vst3\n"}],
    "advisory": [{"name":"style","status":"skipped","duration":0,"attempts":1,"output":"\n","error":"Placeholder - future work\n"},{"name":"naming","status":"skipped","duration":0,"attempts":1,"output":"\n","error":"Placeholder - future work\n"},{"name":"docs","status":"skipped","duration":0,"attempts":1,"output":"\n","error":"Placeholder - future work\n"}]
  },
  "overallStatus": "BYPASSED",
  "totalDuration": 3000
,
  "bypass": {
    "used": true,
    "justification": "Stage 0->1 transition: no source tree exists yet, so the build check cannot pass by definition. Stage 1 execute creates the CMake project. Schema check skipped (no HANDOFF.json for 0-ideation; artifacts BRIEF/REQUIREMENTS/ARCHITECTURE/ROADMAP present).\n",
    "failedChecks": ["build"]
  }
}
