{
  "gate": "gate-1-to-2",
  "plugin": "O-Bassoon",
  "fromStage": "1-foundation",
  "toStage": "2-dsp",
  "timestamp": "2026-04-30T05:51:06Z",
  "checks": {
    "critical": [{"name":"schema","status":"passed","duration":1000,"attempts":1,"output":"Validating: /Users/taylorbrook/Dev/VST-development/plugins/O-Bassoon/.planning/stages/1-foundation/HANDOFF.json\n----------------------------------------\nSchema: handoff-1-to-2.schema.json\nRunning schema validation...\nunknown format \"date-time\" ignored in schema at path \"#/properties/timestamp\"\nunknown format \"date-time\" ignored in schema at path \"#/properties/timestamp\"\nunknown format \"date-time\" ignored in schema at path \"#/properties/validation/properties/checkedAt\"\nunknown format \"date-time\" ignored in schema at path \"#/properties/validation/properties/checkedAt\"\nunknown format \"date\" ignored in schema at path \"decision-entry.schema.json/properties/date\"\nunknown format \"date\" ignored in schema at path \"decision-entry.schema.json/properties/date\"\n/Users/taylorbrook/Dev/VST-development/plugins/O-Bassoon/.planning/stages/1-foundation/HANDOFF.json valid\n\u001b[0;32mSchema validation: PASSED\u001b[0m\n\nChecking artifact existence...\n\u001b[0;32mArtifacts: 8 required, all present\u001b[0m\n\n========================================\n\u001b[0;32mVALIDATION PASSED\u001b[0m\n","error":"\n"},{"name":"build","status":"passed","duration":0,"attempts":1,"output":"[0/2] Re-checking globbed directories...\nninja: no work to do.\n","error":"\n"},{"name":"pluginval","status":"skipped","duration":0,"attempts":1,"output":"\n","error":"VST3 plugin not found at /Users/taylorbrook/Dev/VST-development/build/plugins/O-Bassoon/O-Bassoon_artefacts/Release/VST3/O-Bassoon.vst3\n"}],
    "advisory": [{"name":"style","status":"skipped","duration":0,"attempts":1,"output":"\n","error":"Placeholder - future work\n"},{"name":"naming","status":"skipped","duration":0,"attempts":1,"output":"\n","error":"Placeholder - future work\n"},{"name":"docs","status":"skipped","duration":0,"attempts":1,"output":"\n","error":"Placeholder - future work\n"}]
  },
  "overallStatus": "PASSED",
  "totalDuration": 1000
,
  "review": {
    "status": "skipped",
    "notes": "\n",
    "skipped": true
,    "skipJustification": "No justification provided\n"
  }
}
